{
  "schemaVersion": 1,
  "id": "bbbbbbbbbbbbbbbbbbbbbbbb",
  "version": 3,
  "sourceId": "aaaaaaaaaaaaaaaaaaaaaaaa",
  "sourceRevision": "ba07d42a15fa1c789088494fc8b3485ff84c0a600dfa5b3fb136cf9ffbac0b2e",
  "title": "Synthetic fixture: predict rotating field speed",
  "layout": "split-studio",
  "blocks": [
    {
      "id": "goal",
      "type": "objective",
      "title": "What you will work through",
      "provenance": "authored",
      "citations": [],
      "text": "Predict field speed, check the rule, and explain one limit."
    },
    {
      "id": "source-rule",
      "type": "explanation",
      "title": "Check the source rule",
      "provenance": "excerpt",
      "citations": [
        {
          "page": 0,
          "locator": "Synthetic fixture, section 1",
          "start": 38,
          "end": 135,
          "quote": "Synchronous field speed equals 120 times frequency in hertz divided by the total number of poles."
        }
      ],
      "text": "Synchronous field speed equals 120 times frequency in hertz divided by the total number of poles."
    },
    {
      "id": "example",
      "type": "worked-example",
      "title": "An authored calculation",
      "provenance": "authored",
      "citations": [
        {
          "page": 0,
          "locator": "Synthetic fixture, section 1",
          "start": 38,
          "end": 135,
          "quote": "Synchronous field speed equals 120 times frequency in hertz divided by the total number of poles."
        }
      ],
      "text": "With authored inputs 50 Hz and four poles: 120 × 50 ÷ 4 = 1,500 rpm. This is calculated synchronous field speed."
    },
    {
      "id": "try",
      "type": "activity",
      "title": "Predict before changing a value",
      "provenance": "authored",
      "citations": [
        {
          "page": 0,
          "locator": "Synthetic fixture, section 1",
          "start": 38,
          "end": 135,
          "quote": "Synchronous field speed equals 120 times frequency in hertz divided by the total number of poles."
        }
      ],
      "prompt": "Predict field speed for 50 Hz and six poles, then check the local calculator when integrated.",
      "activity": {
        "kind": "motor-field-speed",
        "frequencyHz": 50,
        "poles": 6
      }
    },
    {
      "id": "check",
      "type": "question",
      "title": "Check your reasoning",
      "provenance": "authored",
      "citations": [
        {
          "page": 0,
          "locator": "Synthetic fixture, section 1",
          "start": 38,
          "end": 135,
          "quote": "Synchronous field speed equals 120 times frequency in hertz divided by the total number of poles."
        }
      ],
      "prompt": "Using the rule with authored inputs 50 Hz and four poles, which result is the synchronous field speed?",
      "options": [
        "1,000 rpm",
        "1,500 rpm",
        "3,000 rpm"
      ],
      "correct": 1
    },
    {
      "id": "reflect",
      "type": "reflection",
      "title": "Explain the limit",
      "provenance": "authored",
      "citations": [],
      "text": "Explain why a calculated rotating-field value should not be presented as measured equipment behaviour."
    }
  ]
}
